,screen_name,username,user_id,tweet_id,tweet_url,timestamp,timestamp_epochs,text,text_html,links,hashtags,has_media,img_urls,video_url,likes,retweets,replies,is_replied,is_reply_to,parent_tweet_id,reply_to_users
0,missdsparks,dsparks,6273952,231210342,/missdsparks/status/231210342,2007-08-27 23:49:44,1188258584,Lovely walk with Heather & the dog.  The weather can just stay like this please and thanks.,"<p class=""TweetTextSize js-tweet-text tweet-text"" data-aria-label-part=""0"" lang=""en"">Lovely walk with Heather &amp; the dog.  The <strong>weather</strong> can just stay like this please and thanks.</p>",[],[],False,[],,0,0,0,False,False,,[]
1,drew23,Andy Kim,8196922,231161412,/drew23/status/231161412,2007-08-27 23:15:06,1188256506,Just working... I wouldve been in Chicago but my trip was cancelled due to horrible weather there. Oh well. I'll try again next month.,"<p class=""TweetTextSize js-tweet-text tweet-text"" data-aria-label-part=""0"" lang=""en"">Just working... I wouldve been in Chicago but my trip was cancelled due to horrible <strong>weather</strong> there. Oh well. I'll try again next month.</p>",[],[],False,[],,0,0,0,False,False,,[]
2,abcnews,ABC News,2768501,231101532,/abcnews/status/231101532,2007-08-27 22:34:22,1188254062,Rescued doctor recovers after NZ caving accident: A New Zealand man who was injured and trapped in a cavi.. http://tinyurl.com/yufo3d,"<p class=""TweetTextSize js-tweet-text tweet-text"" data-aria-label-part=""0"" lang=""en"">Rescued doctor recovers after NZ caving <strong>accident</strong>: A New Zealand man who was injured and trapped in a cavi.. http://tinyurl.com/yufo3d</p>",[],[],False,[],,0,0,0,False,False,,[]
3,KCalhoun,Kristin Calhoun,8407392,231085042,/KCalhoun/status/231085042,2007-08-27 22:21:29,1188253289,Going home!  Want to enjoy some of this nice weather..,"<p class=""TweetTextSize js-tweet-text tweet-text"" data-aria-label-part=""0"" lang=""en"">Going home!  Want to enjoy some of this nice <strong>weather</strong>..</p>",[],[],False,[],,0,0,0,False,False,,[]
4,dfwweather,dfwweather,8472312,231074712,/dfwweather/status/231074712,2007-08-27 22:14:16,1188252856,Weather Test,"<p class=""TweetTextSize js-tweet-text tweet-text"" data-aria-label-part=""0"" lang=""en""><strong>Weather</strong> Test</p>",[],[],False,[],,0,0,0,False,False,,[]
5,pantsface,elijah gonzalez,8394642,231068492,/pantsface/status/231068492,2007-08-27 22:10:43,1188252643,"not liking this hot, humid weather","<p class=""TweetTextSize js-tweet-text tweet-text"" data-aria-label-part=""0"" lang=""en"">not liking this hot, humid <strong>weather</strong></p>",[],[],False,[],,0,0,0,False,False,,[]
6,substitute,The American Caliban,1071091,231061962,/substitute/status/231061962,2007-08-27 22:06:56,1188252416,headline of the day: Monk dies in freak mower accident,"<p class=""TweetTextSize js-tweet-text tweet-text"" data-aria-label-part=""0"" lang=""en"">headline of the day: Monk dies in freak mower <strong>accident</strong></p>",[],[],False,[],,0,0,0,False,False,,[]
7,CLINT,🤠 Howdy Y’all 🤠,45993,231057952,/CLINT/status/231057952,2007-08-27 22:04:37,1188252277,"Weather today is amazing. 74F, no humidity.  Fantastic riding weather.  If only my rear tire wasn't being a jackass","<p class=""TweetTextSize js-tweet-text tweet-text"" data-aria-label-part=""0"" lang=""en""><strong>Weather</strong> today is amazing. 74F, no humidity.  Fantastic riding <strong>weather</strong>.  If only my rear tire wasn't being a jackass</p>",[],[],False,[],,0,0,0,False,False,,[]
8,sailor,Wilson,4013,804763,/sailor/status/804763,2006-12-07 22:12:11,1165529531,"Brisbane weather: A shower or two, partly cloudy. Min 18 C   Max 27C","<p class=""TweetTextSize js-tweet-text tweet-text"" data-aria-label-part=""0"" lang=""en"">Brisbane <strong>weather</strong>: A shower or two, partly cloudy. Min 18 C   Max 27C</p>",[],[],False,[],,0,0,0,False,False,,[]
9,Ronnos,Ron Kok,41093,790293,/Ronnos/status/790293,2006-12-07 17:48:41,1165513721,"is fighting the bad weather on his journey to Amsterdam, all for love...","<p class=""TweetTextSize js-tweet-text tweet-text"" data-aria-label-part=""0"" lang=""en"">is fighting the bad <strong>weather</strong> on his journey to Amsterdam, all for love...</p>",[],[],False,[],,0,0,0,False,False,,[]
10,jpeelle,Jonathan Peelle,37563,786583,/jpeelle/status/786583,2006-12-07 16:01:37,1165507297,loving the cold weather,"<p class=""TweetTextSize js-tweet-text tweet-text"" data-aria-label-part=""0"" lang=""en"">loving the cold <strong>weather</strong></p>",[],[],False,[],,0,0,0,False,False,,[]
11,jmulder,Jeroen Mulder,41023,783143,/jmulder/status/783143,2006-12-07 14:44:35,1165502675,On my way home from uni where our client did not show up at the meeting. PS: the weather is horrible.,"<p class=""TweetTextSize js-tweet-text tweet-text"" data-aria-label-part=""0"" lang=""en"">On my way home from uni where our client did not show up at the meeting. PS: the <strong>weather</strong> is horrible.</p>",[],[],False,[],,0,0,0,False,False,,[]
12,Tuna,Gary Barber,16813,782713,/Tuna/status/782713,2006-12-07 14:28:59,1165501739,"calls it a nite, with the sound of police choppers overhead and the squeal of tyres from the street. Have good trip Thomas, hope the weather is kind. ","<p class=""TweetTextSize js-tweet-text tweet-text"" data-aria-label-part=""0"" lang=""en"">calls it a nite, with the sound of police choppers overhead and the squeal of tyres from the street. Have good trip Thomas, hope the <strong>weather</strong> is kind. </p>",[],[],False,[],,0,0,0,False,False,,[]
13,OllyHodgson,Olly Hodgson,38033,782683,/OllyHodgson/status/782683,2006-12-07 14:26:57,1165501617,has mad hair after going out to face the weather.,"<p class=""TweetTextSize js-tweet-text tweet-text"" data-aria-label-part=""0"" lang=""en"">has mad hair after going out to face the <strong>weather</strong>.</p>",[],[],False,[],,0,0,0,False,False,,[]
14,Schilling,Adam Schilling,45143,780523,/Schilling/status/780523,2006-12-07 12:59:43,1165496383,"@Chris: yes, you Londoners certainly know how to do weather! Still, I think yours would suit me a 100x more than Adelaide's!","<p class=""TweetTextSize js-tweet-text tweet-text"" data-aria-label-part=""0"" lang=""en""><a class=""twitter-atreply pretty-link js-nav"" data-mentioned-user-id=""2442"" dir=""ltr"" href=""/chris""><s>@</s><b>Chris</b></a>: yes, you Londoners certainly know how to do <strong>weather</strong>! Still, I think yours would suit me a 100x more than Adelaide's!</p>",[],[],False,[],,0,0,0,False,False,,[]
15,Schilling,Adam Schilling,45143,779573,/Schilling/status/779573,2006-12-07 12:34:13,1165494853,"is dreading the weather tomorrow (38°C, or 100°F) and on Saturday (39°C, or 102°F). Blech! I want to live some place cooler ... any suggestions?","<p class=""TweetTextSize js-tweet-text tweet-text"" data-aria-label-part=""0"" lang=""en"">is dreading the <strong>weather</strong> tomorrow (38°C, or 100°F) and on Saturday (39°C, or 102°F). Blech! I want to live some place cooler ... any suggestions?</p>",[],[],False,[],,0,0,0,False,False,,[]
16,seldo,Laurie Voss,15453,776973,/seldo/status/776973,2006-12-07 11:09:22,1165489762,This weather is out of control!,"<p class=""TweetTextSize js-tweet-text tweet-text"" data-aria-label-part=""0"" lang=""en"">This <strong>weather</strong> is out of control!</p>",[],[],False,[],,0,0,0,False,False,,[]
17,ray,Ray,12801,757793,/ray/status/757793,2006-12-07 00:02:50,1165449770,Wondering if Noah is checking the weather forecast for Chicago. ,"<p class=""TweetTextSize js-tweet-text tweet-text"" data-aria-label-part=""0"" lang=""en"">Wondering if Noah is checking the <strong>weather</strong> forecast for Chicago. </p>",[],[],False,[],,0,0,0,False,False,,[]
18,sailor,Wilson,4013,751043,/sailor/status/751043,2006-12-06 21:50:40,1165441840,"Thursday morning - bright and clear. And that's me. The weather is good too,","<p class=""TweetTextSize js-tweet-text tweet-text"" data-aria-label-part=""0"" lang=""en"">Thursday morning - bright and clear. And that's me. The <strong>weather</strong> is good too,</p>",[],[],False,[],,0,0,0,False,False,,[]
19,darren,Darren Wood‽,13170,743053,/darren/status/743053,2006-12-06 19:25:10,1165433110,hopes the weather will stay like this for tomorrow,"<p class=""TweetTextSize js-tweet-text tweet-text"" data-aria-label-part=""0"" lang=""en"">hopes the <strong>weather</strong> will stay like this for tomorrow</p>",[],[],False,[],,0,0,0,False,False,,[]
20,chrisjdavis,Chris J. Davis,21853,726663,/chrisjdavis/status/726663,2006-12-06 13:20:28,1165411228,"is back at work, enjoying the sub-zero weather INSIDE the office.","<p class=""TweetTextSize js-tweet-text tweet-text"" data-aria-label-part=""0"" lang=""en"">is back at work, enjoying the sub-zero <strong>weather</strong> INSIDE the office.</p>",[],[],False,[],,0,0,0,False,False,,[]
21,LadyWriting,Bernadette Pasley,37793,723013,/LadyWriting/status/723013,2006-12-06 11:05:37,1165403137,Checking the weather so that I know what to wear today. It's 30 degrees in NYC!,"<p class=""TweetTextSize js-tweet-text tweet-text"" data-aria-label-part=""0"" lang=""en"">Checking the <strong>weather</strong> so that I know what to wear today. It's 30 degrees in NYC!</p>",[],[],False,[],,0,0,0,False,False,,[]
22,FunkyLarma,Adam Chamberlin,24923,719763,/FunkyLarma/status/719763,2006-12-06 09:04:59,1165395899,"Another day on the road, at least the weather is good","<p class=""TweetTextSize js-tweet-text tweet-text"" data-aria-label-part=""0"" lang=""en"">Another day on the road, at least the <strong>weather</strong> is good</p>",[],[],False,[],,0,0,0,False,False,,[]
23,AlienRayGunArt,Dave Anderson,722123,813202388,/AlienRayGunArt/status/813202388,2008-05-16 23:59:47,1210982387,RHCP Stadium Arcadium goes so well with this summer weather,"<p class=""TweetTextSize js-tweet-text tweet-text"" data-aria-label-part=""0"" lang=""en"">RHCP Stadium Arcadium goes so well with this summer <strong>weather</strong></p>",[],[],False,[],,0,0,0,False,False,,[]
24,_DougReynolds,Doug Reynolds,4133261,813201476,/_DougReynolds/status/813201476,2008-05-16 23:58:02,1210982282,"Time to pack up for the weekend, go enjoy some hot weather","<p class=""TweetTextSize js-tweet-text tweet-text"" data-aria-label-part=""0"" lang=""en"">Time to pack up for the weekend, go enjoy some hot <strong>weather</strong></p>",[],[],False,[],,0,0,0,False,False,,[]
25,futurelevel,Jason Brooks,43173,813201358,/futurelevel/status/813201358,2008-05-16 23:57:47,1210982267,the iphone's weather app is crap. Says its 83 in SB but other weather sites give the correct 94.,"<p class=""TweetTextSize js-tweet-text tweet-text"" data-aria-label-part=""0"" lang=""en"">the iphone's <strong>weather</strong> app is crap. Says its 83 in SB but other <strong>weather</strong> sites give the correct 94.</p>",[],[],False,[],,0,0,0,False,False,,[]
26,jumpinroo,jumpinroo,1302211,813201240,/jumpinroo/status/813201240,2008-05-16 23:57:29,1210982249,Accident snagging traffic at 125th and Lex,"<p class=""TweetTextSize js-tweet-text tweet-text"" data-aria-label-part=""0"" lang=""en""><strong>Accident</strong> snagging traffic at 125th and Lex</p>",[],[],False,[],,0,0,0,False,False,,[]
27,lauramariemusic,lauramariemusic,9998012,813200844,/lauramariemusic/status/813200844,2008-05-16 23:56:43,1210982203,"On deck with a glass of wine, perfect weather...sweet!","<p class=""TweetTextSize js-tweet-text tweet-text"" data-aria-label-part=""0"" lang=""en"">On deck with a glass of wine, perfect <strong>weather</strong>...sweet!</p>",[],[],False,[],,0,0,0,False,False,,[]
28,reddit,Reddit,811377,813200550,/reddit/status/813200550,2008-05-16 23:56:09,1210982169,"Orchestra accident. Check the guy on the right. Ouch!: 
 [link]
 [comments] http://tinyurl.com/6bbyud","<p class=""TweetTextSize js-tweet-text tweet-text"" data-aria-label-part=""0"" lang=""en"">Orchestra <strong>accident</strong>. Check the guy on the right. Ouch!: 
 [link]
 [comments] http://tinyurl.com/6bbyud</p>",[],[],False,[],,0,0,0,False,False,,[]
29,sharongs,Sharon Scinicariello,5933232,813200539,/sharongs/status/813200539,2008-05-16 23:56:09,1210982169,"@anna_c I just had sushi, too. Great warm weather food.","<p class=""TweetTextSize js-tweet-text tweet-text"" data-aria-label-part=""0"" lang=""en""><a class=""twitter-atreply pretty-link js-nav"" data-mentioned-user-id=""933246919"" dir=""ltr"" href=""/anna_c""><s>@</s><b>anna_c</b></a> I just had sushi, too. Great warm <strong>weather</strong> food.</p>",[],[],False,[],,0,0,0,False,True,813196621,"[{'screen_name': 'annacreech', 'user_id': '704563'}]"
30,dtboyd,Dylan Boyd,7739582,813200179,/dtboyd/status/813200179,2008-05-16 23:55:27,1210982127,@janetleejohnson I LOVE THE HEAT< THE RAIN < AND THE WHACKY WEATHER> We have Seasons baby. And Micro seasons this year. WOO WHOOO,"<p class=""TweetTextSize js-tweet-text tweet-text"" data-aria-label-part=""0"" lang=""en""><a class=""twitter-atreply pretty-link js-nav"" data-mentioned-user-id=""10111722"" dir=""ltr"" href=""/janetleejohnson""><s>@</s><b>janetleejohnson</b></a> I LOVE THE HEAT&lt; THE RAIN &lt; AND THE WHACKY <strong>WEATHER</strong>&gt; We have Seasons baby. And Micro seasons this year. WOO WHOOO</p>",[],[],False,[],,0,0,0,False,True,813174064,"[{'screen_name': 'janetleejohnson', 'user_id': '10111722'}]"
31,schammy,(ಠ_ಠ),14357021,813199952,/schammy/status/813199952,2008-05-16 23:55:02,1210982102,Nice weather is good for everything except for your web site's traffic! :(,"<p class=""TweetTextSize js-tweet-text tweet-text"" data-aria-label-part=""0"" lang=""en"">Nice <strong>weather</strong> is good for everything except for your web site's traffic! :(</p>",[],[],False,[],,0,0,0,False,False,,[]
32,MentatBashar,Jim,14590752,813199749,/MentatBashar/status/813199749,2008-05-16 23:54:43,1210982083,More perfect cigar weather! Im out with a montesino lancero before I go into work.,"<p class=""TweetTextSize js-tweet-text tweet-text"" data-aria-label-part=""0"" lang=""en"">More perfect cigar <strong>weather</strong>! Im out with a montesino lancero before I go into work.</p>",[],[],False,[],,0,0,0,False,False,,[]
33,nathantwright,Nathan T. Wright,3267891,813199522,/nathantwright/status/813199522,2008-05-16 23:54:18,1210982058,Nothing beats a good warm weather buzz. Thanks @bornliar for the invite out. All days should be like this.,"<p class=""TweetTextSize js-tweet-text tweet-text"" data-aria-label-part=""0"" lang=""en"">Nothing beats a good warm <strong>weather</strong> buzz. Thanks <a class=""twitter-atreply pretty-link js-nav"" data-mentioned-user-id=""3331891"" dir=""ltr"" href=""/BornLiar""><s>@</s><b>bornliar</b></a> for the invite out. All days should be like this.</p>",[],[],False,[],,0,0,0,False,False,,[]
34,calilele,Leigh-Anne,14286766,813199075,/calilele/status/813199075,2008-05-16 23:53:20,1210982000,<Wishing for a convertible right about now. This is perfect weather for it!!,"<p class=""TweetTextSize js-tweet-text tweet-text"" data-aria-label-part=""0"" lang=""en"">&lt;Wishing for a convertible right about now. This is perfect <strong>weather</strong> for it!!</p>",[],[],False,[],,0,0,0,False,False,,[]
35,mel_weather,"Weather Melbourne, A",14359001,813198576,/mel_weather/status/813198576,2008-05-16 23:52:23,1210981943,"Temperature: 7.8°C Dew Point: 6.3°C Relative Humidity: 90%
					Wind Speed: 7.4km/h Wind Gusts: 13.0km/h Wind Directio..","<p class=""TweetTextSize js-tweet-text tweet-text"" data-aria-label-part=""0"" lang=""en"">Temperature: 7.8°C Dew Point: 6.3°C Relative Humidity: 90%
					Wind Speed: 7.4km/h Wind Gusts: 13.0km/h Wind Directio..</p>",[],[],False,[],,0,0,0,False,False,,[]
36,CraigOchs,Craig Ochs,14211730,813198534,/CraigOchs/status/813198534,2008-05-16 23:52:19,1210981939,"weather in Boston, 50 and rain, too bad i missed doing this trip.","<p class=""TweetTextSize js-tweet-text tweet-text"" data-aria-label-part=""0"" lang=""en""><strong>weather</strong> in Boston, 50 and rain, too bad i missed doing this trip.</p>",[],[],False,[],,0,0,0,False,False,,[]
37,chrismart,Christopher Martin,4841,813198039,/chrismart/status/813198039,2008-05-16 23:51:20,1210981880,http://twitpic.com/152v <- Fine food- hot weather- great wine- hot wife- perfect afternoon!,"<p class=""TweetTextSize js-tweet-text tweet-text"" data-aria-label-part=""0"" lang=""en"">http://twitpic.com/152v &lt;- Fine food- hot <strong>weather</strong>- great wine- hot wife- perfect afternoon!</p>",[],[],False,[],,0,0,0,False,False,,[]
38,fox6now,FOX6 News,3888351,813197827,/fox6now/status/813197827,2008-05-16 23:50:56,1210981856,TOP STORY: Bart's Milwaukee Weather Webcast http://tinyurl.com/6489jq,"<p class=""TweetTextSize js-tweet-text tweet-text"" data-aria-label-part=""0"" lang=""en"">TOP STORY: Bart's Milwaukee <strong>Weather</strong> Webcast http://tinyurl.com/6489jq</p>",[],[],False,[],,0,0,0,False,False,,[]
39,ChaputTV,b a s t i a n,14098068,813197679,/ChaputTV/status/813197679,2008-05-16 23:50:36,1210981836,I am sweating WAY too much; wtf I hate this weather!,"<p class=""TweetTextSize js-tweet-text tweet-text"" data-aria-label-part=""0"" lang=""en"">I am sweating WAY too much; wtf I hate this <strong>weather</strong>!</p>",[],[],False,[],,0,0,0,False,False,,[]
40,JonnyPez,JonnyPez,14200371,813197275,/JonnyPez/status/813197275,2008-05-16 23:49:58,1210981798,enjoying the beautiful May weather in Como. Suck it Cali. You're being punished for all your sins,"<p class=""TweetTextSize js-tweet-text tweet-text"" data-aria-label-part=""0"" lang=""en"">enjoying the beautiful May <strong>weather</strong> in Como. Suck it Cali. You're being punished for all your sins</p>",[],[],False,[],,0,0,0,False,False,,[]
41,bhob,Bhob,14805786,813196700,/bhob/status/813196700,2008-05-16 23:48:48,1210981728,Heading out into the beautiful 85 degree weather,"<p class=""TweetTextSize js-tweet-text tweet-text"" data-aria-label-part=""0"" lang=""en"">Heading out into the beautiful 85 degree <strong>weather</strong></p>",[],[],False,[],,0,0,0,False,False,,[]
42,May_Weather_,renci 🇧🇸🇧🇸,217947835,54332280918913024,/May_Weather_/status/54332280918913024,2011-04-02 23:59:59,1301788799,My Top Followers: @liberiangirl4mj @panchajackson @mb_girl_4eva @rockthatswagjb. Find yours @ http://mytopfollowersin2010.com,"<p class=""TweetTextSize js-tweet-text tweet-text"" data-aria-label-part=""0"" lang=""en"">My Top Followers: @liberiangirl4mj <a class=""twitter-atreply pretty-link js-nav"" data-mentioned-user-id=""219304569"" dir=""ltr"" href=""/panchajackson""><s>@</s><b>panchajackson</b></a> <a class=""twitter-atreply pretty-link js-nav"" data-mentioned-user-id=""588502374"" dir=""ltr"" href=""/MB_GiRl_4eva""><s>@</s><b>mb_girl_4eva</b></a> <a class=""twitter-atreply pretty-link js-nav"" data-mentioned-user-id=""139131456"" dir=""ltr"" href=""/RockthatswagJB""><s>@</s><b>rockthatswagjb</b></a>. Find yours @ http://mytopfollowersin2010.com</p>",[],[],False,[],,0,0,0,False,False,,[]
43,penfelin,Elin,21909379,54332276217085952,/penfelin/status/54332276217085952,2011-04-02 23:59:58,1301788798,@Fuper oh my god.. how do you even ask that by accident glen. only you. :'),"<p class=""TweetTextSize js-tweet-text tweet-text"" data-aria-label-part=""0"" lang=""en""><a class=""twitter-atreply pretty-link js-nav"" data-mentioned-user-id=""129308985"" dir=""ltr"" href=""/fuper""><s>@</s><b>Fuper</b></a> oh my god.. how do you even ask that by <strong>accident</strong> glen. only you. :')</p>",[],[],False,[],,0,0,0,False,True,54331655913095168,"[{'screen_name': 'glenbartlett', 'user_id': '21135407'}]"
44,May_Weather_,renci 🇧🇸🇧🇸,217947835,54332275957055488,/May_Weather_/status/54332275957055488,2011-04-02 23:59:58,1301788798,My Top Followers: @mommakmjackson @dollfacebreezy @brie1102 @_hellofalife @crumbaaa. Find yours @ http://mytopfollowersin2010.com,"<p class=""TweetTextSize js-tweet-text tweet-text"" data-aria-label-part=""0"" lang=""en"">My Top Followers: @mommakmjackson <a class=""twitter-atreply pretty-link js-nav"" data-mentioned-user-id=""101015077"" dir=""ltr"" href=""/DollfaceBreezy""><s>@</s><b>dollfacebreezy</b></a> @brie1102 <a class=""twitter-atreply pretty-link js-nav"" data-mentioned-user-id=""179397010"" dir=""ltr"" href=""/_HellOfALife""><s>@</s><b>_hellofalife</b></a> @crumbaaa. Find yours @ http://mytopfollowersin2010.com</p>",[],[],False,[],,0,0,0,False,False,,[]
45,nygiants002,Alvin Hayashida,53194112,54332274430312448,/nygiants002/status/54332274430312448,2011-04-02 23:59:58,1301788798,Nothing like bbqing in good ole California weather.  http://twitpic.com/4g9zrt,"<p class=""TweetTextSize js-tweet-text tweet-text"" data-aria-label-part=""0"" lang=""en"">Nothing like bbqing in good ole California <strong>weather</strong>.  http://twitpic.com/4g9zrt</p>",[],[],False,[],,0,0,0,False,False,,[]
46,May_Weather_,renci 🇧🇸🇧🇸,217947835,54332270391205889,/May_Weather_/status/54332270391205889,2011-04-02 23:59:57,1301788797,My Top Followers: @rocroyallove14 @mjluvspeanut @applehead77 @prettygirlzx3 @iluvlloyd242. Find yours @ http://mytopfollowersin2010.com,"<p class=""TweetTextSize js-tweet-text tweet-text"" data-aria-label-part=""0"" lang=""en"">My Top Followers: @rocroyallove14 @mjluvspeanut <a class=""twitter-atreply pretty-link js-nav"" data-mentioned-user-id=""103416437"" dir=""ltr"" href=""/applehead77""><s>@</s><b>applehead77</b></a> @prettygirlzx3 @iluvlloyd242. Find yours @ http://mytopfollowersin2010.com</p>",[],[],False,[],,0,0,0,False,False,,[]
47,May_Weather_,renci 🇧🇸🇧🇸,217947835,54332270118567936,/May_Weather_/status/54332270118567936,2011-04-02 23:59:57,1301788797,My Top Followers: @rocroyallove14 @mjluvspeanut @applehead77 @prettygirlzx3 @iluvlloyd242. Find yours @ http://mytopfollowersin2010.com,"<p class=""TweetTextSize js-tweet-text tweet-text"" data-aria-label-part=""0"" lang=""en"">My Top Followers: @rocroyallove14 @mjluvspeanut <a class=""twitter-atreply pretty-link js-nav"" data-mentioned-user-id=""103416437"" dir=""ltr"" href=""/applehead77""><s>@</s><b>applehead77</b></a> @prettygirlzx3 @iluvlloyd242. Find yours @ http://mytopfollowersin2010.com</p>",[],[],False,[],,0,0,0,False,False,,[]
48,May_Weather_,renci 🇧🇸🇧🇸,217947835,54332263609020416,/May_Weather_/status/54332263609020416,2011-04-02 23:59:55,1301788795,My Top Followers: @kimkiraspeanut @kimkiraluvsmj @eggheadwifey @billiejean79 @msmjfan @yfg1. Find yours @ http://mytopfollowersin2010.com,"<p class=""TweetTextSize js-tweet-text tweet-text"" data-aria-label-part=""0"" lang=""en"">My Top Followers: @kimkiraspeanut @kimkiraluvsmj @eggheadwifey <a class=""twitter-atreply pretty-link js-nav"" data-mentioned-user-id=""837394147757654018"" dir=""ltr"" href=""/billiejean79""><s>@</s><b>billiejean79</b></a> @msmjfan <a class=""twitter-atreply pretty-link js-nav"" data-mentioned-user-id=""229393036"" dir=""ltr"" href=""/yfg1""><s>@</s><b>yfg1</b></a>. Find yours @ http://mytopfollowersin2010.com</p>",[],[],False,[],,0,0,0,False,False,,[]
49,gailsfknawesome,Gailey G,24145868,54332261251825664,/gailsfknawesome/status/54332261251825664,2011-04-02 23:59:55,1301788795,Posted at the @costco's Food Truck Festival.  Hella trucks & Weather is great!!!,"<p class=""TweetTextSize js-tweet-text tweet-text"" data-aria-label-part=""0"" lang=""en"">Posted at the <a class=""twitter-atreply pretty-link js-nav"" data-mentioned-user-id=""1056152593"" dir=""ltr"" href=""/Costco""><s>@</s><b>costco</b></a>'s Food Truck Festival.  Hella trucks &amp; <strong>Weather</strong> is great!!!</p>",[],[],False,[],,0,0,0,False,False,,[]
50,ev_weather,Eagle Vale Weather,211004319,54332261235036160,/ev_weather/status/54332261235036160,2011-04-02 23:59:55,1301788795,"10:00 - Temp: 22.6°C, Indoor: 24.3, Wind: NW 3.1 km/h, Cond: Dry, Rain: 0.0mm, Today:   0.0 mm.","<p class=""TweetTextSize js-tweet-text tweet-text"" data-aria-label-part=""0"" lang=""en"">10:00 - Temp: 22.6°C, Indoor: 24.3, Wind: NW 3.1 km/h, Cond: Dry, Rain: 0.0mm, Today:   0.0 mm.</p>",[],[],False,[],,0,0,0,False,False,,[]
51,medicalnewser,Medicalnewser.com,18310337,54332259054002176,/medicalnewser/status/54332259054002176,2011-04-02 23:59:54,1301788794,medicalnewser.com: Sea creatures’ sex protein provides new insight into diabetes: A genetic accident in th... http://tinyurl.com/44lllky,"<p class=""TweetTextSize js-tweet-text tweet-text"" data-aria-label-part=""0"" lang=""en"">medicalnewser.com: Sea creatures’ sex protein provides new insight into diabetes: A genetic <strong>accident</strong> in th... http://tinyurl.com/44lllky</p>",[],[],False,[],,0,0,0,False,False,,[]
52,wxleeuwarden,wxleeuwarden,99059625,54332253664321536,/wxleeuwarden/status/54332253664321536,2011-04-02 23:59:53,1301788793,Leeuwarden Weather - Current conditions (as of 1:25 AM) Cloudy. 11°C (Feels like 11). Humidity: 87% Winds: 5 km/hr… http://goo.gl/fb/HtJkr,"<p class=""TweetTextSize js-tweet-text tweet-text"" data-aria-label-part=""0"" lang=""en"">Leeuwarden <strong>Weather</strong> - Current conditions (as of 1:25 AM) Cloudy. 11°C (Feels like 11). Humidity: 87% Winds: 5 km/hr… http://goo.gl/fb/HtJkr</p>",[],[],False,[],,0,0,0,False,False,,[]
53,May_Weather_,renci 🇧🇸🇧🇸,217947835,54332247431577600,/May_Weather_/status/54332247431577600,2011-04-02 23:59:51,1301788791,My Top Followers: @tamaraloves3tmj @mindlesstinee @austinbu2h98 @_shortchoclate. Find yours @ http://mytopfollowersin2010.com,"<p class=""TweetTextSize js-tweet-text tweet-text"" data-aria-label-part=""0"" lang=""en"">My Top Followers: @tamaraloves3tmj @mindlesstinee @austinbu2h98 <a class=""twitter-atreply pretty-link js-nav"" data-mentioned-user-id=""219864087"" dir=""ltr"" href=""/_SHORTCHOCLATE""><s>@</s><b>_shortchoclate</b></a>. Find yours @ http://mytopfollowersin2010.com</p>",[],[],False,[],,0,0,0,False,False,,[]
